{
  "schema_version": "1.0",
  "scene_id": 2104,
  "seed": 2104,
  "epoch_utc": "2026-09-08T00:00:00Z",
  "frame": "Earth-centered inertial; circular two-body elements",
  "target_source": "synthetic independent elements; no real-object identity",
  "config": {
    "dt": 0.2,
    "horizon": 900.0,
    "init_deadline": 120.0,
    "hold": 200.0,
    "epsilon_r": 500.0,
    "epsilon_v": 25.0,
    "q": 0.0001,
    "sigma_angle": 0.0001,
    "sigma_range": 50.0,
    "max_range": 2000000.0,
    "off_nadir": 60.0,
    "fov": 1.0,
    "omega": 5.0,
    "acceleration": 2.5,
    "settle": 2.0,
    "capture": 5.0,
    "continuous_limit": 60.0,
    "laser_budget": 180.0,
    "warning": 0.8,
    "fixed_dwell": 20.0,
    "duration_multipliers": [
      1.0,
      1.5
    ]
  },
  "observers": [
    {
      "id": 0,
      "orbit": {
        "radius_m": 7178137.0,
        "inclination_deg": 60.0,
        "raan_deg": 41.87175250600463,
        "phase_deg": 237.15234009868018
      }
    },
    {
      "id": 1,
      "orbit": {
        "radius_m": 7178137.0,
        "inclination_deg": 60.0,
        "raan_deg": 41.87175250600463,
        "phase_deg": 277.15234009868016
      }
    },
    {
      "id": 2,
      "orbit": {
        "radius_m": 7178137.0,
        "inclination_deg": 60.0,
        "raan_deg": 41.87175250600463,
        "phase_deg": 317.15234009868016
      }
    },
    {
      "id": 3,
      "orbit": {
        "radius_m": 7178137.0,
        "inclination_deg": 60.0,
        "raan_deg": 41.87175250600463,
        "phase_deg": 357.15234009868016
      }
    },
    {
      "id": 4,
      "orbit": {
        "radius_m": 7178137.0,
        "inclination_deg": 60.0,
        "raan_deg": 41.87175250600463,
        "phase_deg": 397.15234009868016
      }
    },
    {
      "id": 5,
      "orbit": {
        "radius_m": 7178137.0,
        "inclination_deg": 60.0,
        "raan_deg": 41.87175250600463,
        "phase_deg": 437.15234009868016
      }
    },
    {
      "id": 6,
      "orbit": {
        "radius_m": 7178137.0,
        "inclination_deg": 60.0,
        "raan_deg": 41.87175250600463,
        "phase_deg": 477.15234009868016
      }
    },
    {
      "id": 7,
      "orbit": {
        "radius_m": 7178137.0,
        "inclination_deg": 60.0,
        "raan_deg": 41.87175250600463,
        "phase_deg": 517.1523400986802
      }
    },
    {
      "id": 8,
      "orbit": {
        "radius_m": 7178137.0,
        "inclination_deg": 60.0,
        "raan_deg": 41.87175250600463,
        "phase_deg": 557.1523400986802
      }
    },
    {
      "id": 9,
      "orbit": {
        "radius_m": 7178137.0,
        "inclination_deg": 60.0,
        "raan_deg": 86.87175250600464,
        "phase_deg": 242.15234009868018
      }
    },
    {
      "id": 10,
      "orbit": {
        "radius_m": 7178137.0,
        "inclination_deg": 60.0,
        "raan_deg": 86.87175250600464,
        "phase_deg": 282.15234009868016
      }
    },
    {
      "id": 11,
      "orbit": {
        "radius_m": 7178137.0,
        "inclination_deg": 60.0,
        "raan_deg": 86.87175250600464,
        "phase_deg": 322.15234009868016
      }
    },
    {
      "id": 12,
      "orbit": {
        "radius_m": 7178137.0,
        "inclination_deg": 60.0,
        "raan_deg": 86.87175250600464,
        "phase_deg": 362.15234009868016
      }
    },
    {
      "id": 13,
      "orbit": {
        "radius_m": 7178137.0,
        "inclination_deg": 60.0,
        "raan_deg": 86.87175250600464,
        "phase_deg": 402.15234009868016
      }
    },
    {
      "id": 14,
      "orbit": {
        "radius_m": 7178137.0,
        "inclination_deg": 60.0,
        "raan_deg": 86.87175250600464,
        "phase_deg": 442.15234009868016
      }
    },
    {
      "id": 15,
      "orbit": {
        "radius_m": 7178137.0,
        "inclination_deg": 60.0,
        "raan_deg": 86.87175250600464,
        "phase_deg": 482.15234009868016
      }
    },
    {
      "id": 16,
      "orbit": {
        "radius_m": 7178137.0,
        "inclination_deg": 60.0,
        "raan_deg": 86.87175250600464,
        "phase_deg": 522.1523400986802
      }
    },
    {
      "id": 17,
      "orbit": {
        "radius_m": 7178137.0,
        "inclination_deg": 60.0,
        "raan_deg": 86.87175250600464,
        "phase_deg": 562.1523400986802
      }
    },
    {
      "id": 18,
      "orbit": {
        "radius_m": 7178137.0,
        "inclination_deg": 60.0,
        "raan_deg": 131.87175250600464,
        "phase_deg": 247.15234009868018
      }
    },
    {
      "id": 19,
      "orbit": {
        "radius_m": 7178137.0,
        "inclination_deg": 60.0,
        "raan_deg": 131.87175250600464,
        "phase_deg": 287.15234009868016
      }
    },
    {
      "id": 20,
      "orbit": {
        "radius_m": 7178137.0,
        "inclination_deg": 60.0,
        "raan_deg": 131.87175250600464,
        "phase_deg": 327.15234009868016
      }
    },
    {
      "id": 21,
      "orbit": {
        "radius_m": 7178137.0,
        "inclination_deg": 60.0,
        "raan_deg": 131.87175250600464,
        "phase_deg": 367.15234009868016
      }
    },
    {
      "id": 22,
      "orbit": {
        "radius_m": 7178137.0,
        "inclination_deg": 60.0,
        "raan_deg": 131.87175250600464,
        "phase_deg": 407.15234009868016
      }
    },
    {
      "id": 23,
      "orbit": {
        "radius_m": 7178137.0,
        "inclination_deg": 60.0,
        "raan_deg": 131.87175250600464,
        "phase_deg": 447.15234009868016
      }
    },
    {
      "id": 24,
      "orbit": {
        "radius_m": 7178137.0,
        "inclination_deg": 60.0,
        "raan_deg": 131.87175250600464,
        "phase_deg": 487.15234009868016
      }
    },
    {
      "id": 25,
      "orbit": {
        "radius_m": 7178137.0,
        "inclination_deg": 60.0,
        "raan_deg": 131.87175250600464,
        "phase_deg": 527.1523400986802
      }
    },
    {
      "id": 26,
      "orbit": {
        "radius_m": 7178137.0,
        "inclination_deg": 60.0,
        "raan_deg": 131.87175250600464,
        "phase_deg": 567.1523400986802
      }
    },
    {
      "id": 27,
      "orbit": {
        "radius_m": 7178137.0,
        "inclination_deg": 60.0,
        "raan_deg": 176.87175250600464,
        "phase_deg": 252.15234009868018
      }
    },
    {
      "id": 28,
      "orbit": {
        "radius_m": 7178137.0,
        "inclination_deg": 60.0,
        "raan_deg": 176.87175250600464,
        "phase_deg": 292.15234009868016
      }
    },
    {
      "id": 29,
      "orbit": {
        "radius_m": 7178137.0,
        "inclination_deg": 60.0,
        "raan_deg": 176.87175250600464,
        "phase_deg": 332.15234009868016
      }
    },
    {
      "id": 30,
      "orbit": {
        "radius_m": 7178137.0,
        "inclination_deg": 60.0,
        "raan_deg": 176.87175250600464,
        "phase_deg": 372.15234009868016
      }
    },
    {
      "id": 31,
      "orbit": {
        "radius_m": 7178137.0,
        "inclination_deg": 60.0,
        "raan_deg": 176.87175250600464,
        "phase_deg": 412.15234009868016
      }
    },
    {
      "id": 32,
      "orbit": {
        "radius_m": 7178137.0,
        "inclination_deg": 60.0,
        "raan_deg": 176.87175250600464,
        "phase_deg": 452.15234009868016
      }
    },
    {
      "id": 33,
      "orbit": {
        "radius_m": 7178137.0,
        "inclination_deg": 60.0,
        "raan_deg": 176.87175250600464,
        "phase_deg": 492.15234009868016
      }
    },
    {
      "id": 34,
      "orbit": {
        "radius_m": 7178137.0,
        "inclination_deg": 60.0,
        "raan_deg": 176.87175250600464,
        "phase_deg": 532.1523400986802
      }
    },
    {
      "id": 35,
      "orbit": {
        "radius_m": 7178137.0,
        "inclination_deg": 60.0,
        "raan_deg": 176.87175250600464,
        "phase_deg": 572.1523400986802
      }
    },
    {
      "id": 36,
      "orbit": {
        "radius_m": 7178137.0,
        "inclination_deg": 60.0,
        "raan_deg": 221.87175250600464,
        "phase_deg": 257.15234009868016
      }
    },
    {
      "id": 37,
      "orbit": {
        "radius_m": 7178137.0,
        "inclination_deg": 60.0,
        "raan_deg": 221.87175250600464,
        "phase_deg": 297.15234009868016
      }
    },
    {
      "id": 38,
      "orbit": {
        "radius_m": 7178137.0,
        "inclination_deg": 60.0,
        "raan_deg": 221.87175250600464,
        "phase_deg": 337.15234009868016
      }
    },
    {
      "id": 39,
      "orbit": {
        "radius_m": 7178137.0,
        "inclination_deg": 60.0,
        "raan_deg": 221.87175250600464,
        "phase_deg": 377.15234009868016
      }
    },
    {
      "id": 40,
      "orbit": {
        "radius_m": 7178137.0,
        "inclination_deg": 60.0,
        "raan_deg": 221.87175250600464,
        "phase_deg": 417.15234009868016
      }
    },
    {
      "id": 41,
      "orbit": {
        "radius_m": 7178137.0,
        "inclination_deg": 60.0,
        "raan_deg": 221.87175250600464,
        "phase_deg": 457.15234009868016
      }
    },
    {
      "id": 42,
      "orbit": {
        "radius_m": 7178137.0,
        "inclination_deg": 60.0,
        "raan_deg": 221.87175250600464,
        "phase_deg": 497.15234009868016
      }
    },
    {
      "id": 43,
      "orbit": {
        "radius_m": 7178137.0,
        "inclination_deg": 60.0,
        "raan_deg": 221.87175250600464,
        "phase_deg": 537.1523400986802
      }
    },
    {
      "id": 44,
      "orbit": {
        "radius_m": 7178137.0,
        "inclination_deg": 60.0,
        "raan_deg": 221.87175250600464,
        "phase_deg": 577.1523400986802
      }
    },
    {
      "id": 45,
      "orbit": {
        "radius_m": 7178137.0,
        "inclination_deg": 60.0,
        "raan_deg": 266.8717525060046,
        "phase_deg": 262.15234009868016
      }
    },
    {
      "id": 46,
      "orbit": {
        "radius_m": 7178137.0,
        "inclination_deg": 60.0,